Work,Range,Notes
Generator interlock kit (portable generator),$485–$885,Cheapest legal way to back-feed your panel. Mechanical interlock prevents back-feed to grid.
Manual transfer switch (6–10 circuit),"$985–$1,685",Pre-selected critical circuits. Switch them to generator manually.
Inlet box for portable generator (outdoor),$385–$685,"Generator plugs into outdoor inlet, no extension cords through windows."
Standby whole-home generator install (electrical only),"$2,485–$4,985","Generator and gas line separate trades. We do automatic transfer switch, sub-panel, controls."
"Battery backup install (Tesla Powerwall, Enphase, etc.)","$1,985–$4,985",Electrical install only. Solar integration priced separately.
