Scope,Range,What changes
"Vacant home, drywall open, easy access",$5–$8 / sqft,Best case. Mid-renovation timing.
"Occupied home, finished walls, careful",$8–$12 / sqft,"Typical. We work room by room, minimize patches."
"Plaster & lath, decorative ceilings to preserve",$11–$16 / sqft,"Older Cincinnati homes. Surgical work, higher access cost."
"Whole-home rewire of 1,200 sqft typical home","$9,800–$14,500","Worked example, single-story, finished walls."
"Whole-home rewire of 2,000 sqft typical home","$16,000–$24,000","Worked example, two-story, finished."
